{
  "image": "buildings.png",
  "size": [
    256,
    759
  ],
  "tile": 16,
  "frames": {
    "civic_clinic": {
      "x": 65,
      "y": 372,
      "w": 64,
      "h": 48,
      "anchor": [
        32,
        47
      ],
      "snow": "civic_clinic_snow",
      "footprint": [
        4,
        2
      ]
    },
    "civic_clinic_snow": {
      "x": 130,
      "y": 372,
      "w": 64,
      "h": 48,
      "anchor": [
        32,
        47
      ],
      "layer": "snow",
      "footprint": [
        4,
        2
      ]
    },
    "civic_courthouse": {
      "x": 0,
      "y": 423,
      "w": 80,
      "h": 48,
      "anchor": [
        40,
        47
      ],
      "snow": "civic_courthouse_snow",
      "footprint": [
        5,
        2
      ]
    },
    "civic_courthouse_snow": {
      "x": 81,
      "y": 423,
      "w": 80,
      "h": 48,
      "anchor": [
        40,
        47
      ],
      "layer": "snow",
      "footprint": [
        5,
        2
      ]
    },
    "civic_jail": {
      "x": 162,
      "y": 423,
      "w": 64,
      "h": 48,
      "anchor": [
        32,
        47
      ],
      "snow": "civic_jail_snow",
      "footprint": [
        4,
        2
      ]
    },
    "civic_jail_snow": {
      "x": 0,
      "y": 472,
      "w": 64,
      "h": 48,
      "anchor": [
        32,
        47
      ],
      "layer": "snow",
      "footprint": [
        4,
        2
      ]
    },
    "civic_police-station": {
      "x": 65,
      "y": 472,
      "w": 64,
      "h": 48,
      "anchor": [
        32,
        47
      ],
      "snow": "civic_police-station_snow",
      "footprint": [
        4,
        2
      ]
    },
    "civic_police-station_snow": {
      "x": 130,
      "y": 472,
      "w": 64,
      "h": 48,
      "anchor": [
        32,
        47
      ],
      "layer": "snow",
      "footprint": [
        4,
        2
      ]
    },
    "civic_records-office": {
      "x": 0,
      "y": 521,
      "w": 64,
      "h": 48,
      "anchor": [
        32,
        47
      ],
      "snow": "civic_records-office_snow",
      "footprint": [
        4,
        2
      ]
    },
    "civic_records-office_snow": {
      "x": 65,
      "y": 521,
      "w": 64,
      "h": 48,
      "anchor": [
        32,
        47
      ],
      "layer": "snow",
      "footprint": [
        4,
        2
      ]
    },
    "civic_school": {
      "x": 65,
      "y": 67,
      "w": 64,
      "h": 61,
      "anchor": [
        32,
        60
      ],
      "snow": "civic_school_snow",
      "footprint": [
        4,
        2
      ]
    },
    "civic_school_snow": {
      "x": 130,
      "y": 67,
      "w": 64,
      "h": 61,
      "anchor": [
        32,
        60
      ],
      "layer": "snow",
      "footprint": [
        4,
        2
      ]
    },
    "civic_town-hall": {
      "x": 0,
      "y": 134,
      "w": 80,
      "h": 60,
      "anchor": [
        40,
        59
      ],
      "snow": "civic_town-hall_snow",
      "footprint": [
        5,
        2
      ]
    },
    "civic_town-hall_snow": {
      "x": 81,
      "y": 134,
      "w": 80,
      "h": 60,
      "anchor": [
        40,
        59
      ],
      "layer": "snow",
      "footprint": [
        5,
        2
      ]
    },
    "shop_bakery": {
      "x": 81,
      "y": 195,
      "w": 64,
      "h": 58,
      "anchor": [
        32,
        57
      ],
      "snow": "shop_bakery_snow",
      "footprint": [
        4,
        2
      ],
      "door": [
        32,
        56
      ]
    },
    "shop_bakery_snow": {
      "x": 146,
      "y": 195,
      "w": 64,
      "h": 58,
      "anchor": [
        32,
        57
      ],
      "layer": "snow",
      "footprint": [
        4,
        2
      ]
    },
    "shop_general": {
      "x": 130,
      "y": 521,
      "w": 64,
      "h": 48,
      "anchor": [
        32,
        47
      ],
      "snow": "shop_general_snow",
      "footprint": [
        4,
        2
      ]
    },
    "shop_general_snow": {
      "x": 0,
      "y": 570,
      "w": 64,
      "h": 48,
      "anchor": [
        32,
        47
      ],
      "layer": "snow",
      "footprint": [
        4,
        2
      ]
    },
    "shop_inn": {
      "x": 0,
      "y": 0,
      "w": 80,
      "h": 66,
      "anchor": [
        40,
        65
      ],
      "snow": "shop_inn_snow",
      "footprint": [
        5,
        2
      ],
      "door": [
        40,
        64
      ]
    },
    "shop_inn_snow": {
      "x": 81,
      "y": 0,
      "w": 80,
      "h": 66,
      "anchor": [
        40,
        65
      ],
      "layer": "snow",
      "footprint": [
        5,
        2
      ]
    },
    "shop_market-stall": {
      "x": 65,
      "y": 570,
      "w": 48,
      "h": 48,
      "anchor": [
        24,
        47
      ],
      "footprint": [
        3,
        2
      ]
    },
    "shop_market-stall_closed": {
      "x": 114,
      "y": 570,
      "w": 48,
      "h": 48,
      "anchor": [
        24,
        47
      ],
      "footprint": [
        3,
        2
      ]
    },
    "shop_warehouse": {
      "x": 163,
      "y": 570,
      "w": 64,
      "h": 48,
      "anchor": [
        32,
        47
      ],
      "snow": "shop_warehouse_snow",
      "footprint": [
        4,
        2
      ]
    },
    "shop_warehouse_snow": {
      "x": 0,
      "y": 619,
      "w": 64,
      "h": 48,
      "anchor": [
        32,
        47
      ],
      "layer": "snow",
      "footprint": [
        4,
        2
      ]
    },
    "work_dock": {
      "x": 162,
      "y": 0,
      "w": 64,
      "h": 66,
      "anchor": [
        32,
        39
      ],
      "snow": "work_dock_snow",
      "footprint": [
        4,
        2
      ]
    },
    "work_dock_snow": {
      "x": 0,
      "y": 67,
      "w": 64,
      "h": 66,
      "anchor": [
        32,
        39
      ],
      "layer": "snow",
      "footprint": [
        4,
        2
      ]
    },
    "work_farm": {
      "x": 162,
      "y": 134,
      "w": 80,
      "h": 60,
      "anchor": [
        40,
        59
      ],
      "snow": "work_farm_snow",
      "footprint": [
        5,
        2
      ]
    },
    "work_farm_snow": {
      "x": 0,
      "y": 195,
      "w": 80,
      "h": 60,
      "anchor": [
        40,
        59
      ],
      "layer": "snow",
      "footprint": [
        5,
        2
      ]
    },
    "work_fuel-works": {
      "x": 65,
      "y": 619,
      "w": 64,
      "h": 48,
      "anchor": [
        32,
        47
      ],
      "footprint": [
        4,
        2
      ]
    },
    "work_lumber-camp": {
      "x": 130,
      "y": 619,
      "w": 80,
      "h": 46,
      "anchor": [
        40,
        45
      ],
      "snow": "work_lumber-camp_snow",
      "footprint": [
        5,
        2
      ]
    },
    "work_lumber-camp_snow": {
      "x": 0,
      "y": 668,
      "w": 80,
      "h": 46,
      "anchor": [
        40,
        45
      ],
      "layer": "snow",
      "footprint": [
        5,
        2
      ]
    },
    "work_mine": {
      "x": 0,
      "y": 372,
      "w": 64,
      "h": 50,
      "anchor": [
        32,
        49
      ],
      "footprint": [
        4,
        2
      ]
    },
    "work_pasture": {
      "x": 146,
      "y": 668,
      "w": 64,
      "h": 44,
      "anchor": [
        32,
        43
      ],
      "snow": "work_pasture_snow",
      "footprint": [
        4,
        2
      ]
    },
    "work_pasture_snow": {
      "x": 0,
      "y": 715,
      "w": 64,
      "h": 44,
      "anchor": [
        32,
        43
      ],
      "layer": "snow",
      "footprint": [
        4,
        2
      ]
    },
    "work_quarry": {
      "x": 81,
      "y": 668,
      "w": 64,
      "h": 46,
      "anchor": [
        32,
        45
      ],
      "footprint": [
        4,
        2
      ]
    },
    "work_smithy": {
      "x": 0,
      "y": 256,
      "w": 64,
      "h": 57,
      "anchor": [
        32,
        56
      ],
      "snow": "work_smithy_snow",
      "footprint": [
        4,
        2
      ],
      "door": [
        32,
        55
      ]
    },
    "work_smithy_snow": {
      "x": 65,
      "y": 256,
      "w": 64,
      "h": 57,
      "anchor": [
        32,
        56
      ],
      "layer": "snow",
      "footprint": [
        4,
        2
      ]
    },
    "work_stable": {
      "x": 65,
      "y": 314,
      "w": 80,
      "h": 54,
      "anchor": [
        40,
        53
      ],
      "snow": "work_stable_snow",
      "footprint": [
        5,
        2
      ],
      "door": [
        40,
        52
      ]
    },
    "work_stable_snow": {
      "x": 146,
      "y": 314,
      "w": 80,
      "h": 54,
      "anchor": [
        40,
        53
      ],
      "layer": "snow",
      "footprint": [
        5,
        2
      ]
    },
    "work_workshop": {
      "x": 130,
      "y": 256,
      "w": 64,
      "h": 57,
      "anchor": [
        32,
        56
      ],
      "snow": "work_workshop_snow",
      "footprint": [
        4,
        2
      ]
    },
    "work_workshop_snow": {
      "x": 0,
      "y": 314,
      "w": 64,
      "h": 57,
      "anchor": [
        32,
        56
      ],
      "layer": "snow",
      "footprint": [
        4,
        2
      ]
    }
  }
}
