{
  "image": "landmarks.png",
  "size": [
    256,
    430
  ],
  "tile": 16,
  "frames": {
    "landmark_amphitheatre": {
      "x": 0,
      "y": 170,
      "w": 96,
      "h": 64,
      "anchor": [
        48,
        63
      ],
      "footprint": [
        6,
        4
      ]
    },
    "landmark_clock-tower": {
      "x": 0,
      "y": 0,
      "w": 32,
      "h": 96,
      "anchor": [
        16,
        95
      ],
      "footprint": [
        2,
        2
      ]
    },
    "landmark_fountain_0": {
      "x": 98,
      "y": 300,
      "w": 48,
      "h": 48,
      "anchor": [
        24,
        47
      ],
      "footprint": [
        3,
        2
      ]
    },
    "landmark_fountain_1": {
      "x": 147,
      "y": 300,
      "w": 48,
      "h": 48,
      "anchor": [
        24,
        47
      ],
      "footprint": [
        3,
        2
      ]
    },
    "landmark_garden-terraces": {
      "x": 0,
      "y": 97,
      "w": 96,
      "h": 72,
      "anchor": [
        48,
        71
      ],
      "footprint": [
        6,
        3
      ]
    },
    "landmark_glasshouse": {
      "x": 97,
      "y": 170,
      "w": 96,
      "h": 64,
      "anchor": [
        48,
        63
      ],
      "footprint": [
        6,
        2
      ]
    },
    "landmark_library": {
      "x": 97,
      "y": 97,
      "w": 96,
      "h": 72,
      "anchor": [
        48,
        71
      ],
      "footprint": [
        6,
        2
      ]
    },
    "landmark_lighthouse_0": {
      "x": 33,
      "y": 0,
      "w": 48,
      "h": 96,
      "anchor": [
        24,
        95
      ],
      "footprint": [
        3,
        2
      ]
    },
    "landmark_lighthouse_1": {
      "x": 82,
      "y": 0,
      "w": 48,
      "h": 96,
      "anchor": [
        24,
        95
      ],
      "footprint": [
        3,
        2
      ]
    },
    "landmark_lighthouse_2": {
      "x": 131,
      "y": 0,
      "w": 48,
      "h": 96,
      "anchor": [
        24,
        95
      ],
      "footprint": [
        3,
        2
      ]
    },
    "landmark_observatory": {
      "x": 0,
      "y": 235,
      "w": 64,
      "h": 64,
      "anchor": [
        32,
        63
      ],
      "footprint": [
        4,
        3
      ],
      "night": "landmark_observatory_night"
    },
    "landmark_observatory_night": {
      "x": 65,
      "y": 235,
      "w": 64,
      "h": 64,
      "anchor": [
        32,
        63
      ],
      "footprint": [
        4,
        3
      ],
      "layer": "night"
    },
    "landmark_viaduct_end-left": {
      "x": 0,
      "y": 365,
      "w": 64,
      "h": 48,
      "anchor": [
        32,
        47
      ],
      "footprint": [
        4,
        1
      ],
      "joins": "r"
    },
    "landmark_viaduct_end-right": {
      "x": 65,
      "y": 365,
      "w": 64,
      "h": 48,
      "anchor": [
        32,
        47
      ],
      "footprint": [
        4,
        1
      ],
      "joins": "l"
    },
    "landmark_viaduct_span": {
      "x": 130,
      "y": 365,
      "w": 32,
      "h": 48,
      "anchor": [
        16,
        47
      ],
      "footprint": [
        2,
        1
      ],
      "joins": "lr"
    },
    "landmark_windmill_0": {
      "x": 130,
      "y": 235,
      "w": 48,
      "h": 64,
      "anchor": [
        24,
        63
      ],
      "footprint": [
        3,
        2
      ]
    },
    "landmark_windmill_1": {
      "x": 179,
      "y": 235,
      "w": 48,
      "h": 64,
      "anchor": [
        24,
        63
      ],
      "footprint": [
        3,
        2
      ]
    },
    "landmark_windmill_2": {
      "x": 0,
      "y": 300,
      "w": 48,
      "h": 64,
      "anchor": [
        24,
        63
      ],
      "footprint": [
        3,
        2
      ]
    },
    "landmark_windmill_3": {
      "x": 49,
      "y": 300,
      "w": 48,
      "h": 64,
      "anchor": [
        24,
        63
      ],
      "footprint": [
        3,
        2
      ]
    },
    "map16_landmark_amphitheatre": {
      "x": 197,
      "y": 365,
      "w": 16,
      "h": 16,
      "anchor": [
        8,
        15
      ]
    },
    "map16_landmark_clock-tower": {
      "x": 180,
      "y": 365,
      "w": 16,
      "h": 23,
      "anchor": [
        8,
        22
      ]
    },
    "map16_landmark_fountain": {
      "x": 214,
      "y": 365,
      "w": 16,
      "h": 16,
      "anchor": [
        8,
        15
      ]
    },
    "map16_landmark_garden-terraces": {
      "x": 231,
      "y": 365,
      "w": 16,
      "h": 16,
      "anchor": [
        8,
        15
      ]
    },
    "map16_landmark_glasshouse": {
      "x": 0,
      "y": 414,
      "w": 16,
      "h": 16,
      "anchor": [
        8,
        15
      ]
    },
    "map16_landmark_library": {
      "x": 17,
      "y": 414,
      "w": 16,
      "h": 16,
      "anchor": [
        8,
        15
      ]
    },
    "map16_landmark_lighthouse": {
      "x": 163,
      "y": 365,
      "w": 16,
      "h": 24,
      "anchor": [
        8,
        23
      ]
    },
    "map16_landmark_observatory": {
      "x": 34,
      "y": 414,
      "w": 16,
      "h": 16,
      "anchor": [
        8,
        15
      ]
    },
    "map16_landmark_viaduct": {
      "x": 51,
      "y": 414,
      "w": 16,
      "h": 16,
      "anchor": [
        8,
        15
      ]
    },
    "map16_landmark_windmill": {
      "x": 68,
      "y": 414,
      "w": 16,
      "h": 16,
      "anchor": [
        8,
        15
      ]
    },
    "map8_landmark_amphitheatre": {
      "x": 103,
      "y": 414,
      "w": 8,
      "h": 8,
      "anchor": [
        4,
        7
      ]
    },
    "map8_landmark_clock-tower": {
      "x": 94,
      "y": 414,
      "w": 8,
      "h": 9,
      "anchor": [
        4,
        8
      ]
    },
    "map8_landmark_fountain": {
      "x": 112,
      "y": 414,
      "w": 8,
      "h": 8,
      "anchor": [
        4,
        7
      ]
    },
    "map8_landmark_garden-terraces": {
      "x": 121,
      "y": 414,
      "w": 8,
      "h": 8,
      "anchor": [
        4,
        7
      ]
    },
    "map8_landmark_glasshouse": {
      "x": 130,
      "y": 414,
      "w": 8,
      "h": 8,
      "anchor": [
        4,
        7
      ]
    },
    "map8_landmark_library": {
      "x": 139,
      "y": 414,
      "w": 8,
      "h": 8,
      "anchor": [
        4,
        7
      ]
    },
    "map8_landmark_lighthouse": {
      "x": 85,
      "y": 414,
      "w": 8,
      "h": 10,
      "anchor": [
        4,
        9
      ]
    },
    "map8_landmark_observatory": {
      "x": 148,
      "y": 414,
      "w": 8,
      "h": 8,
      "anchor": [
        4,
        7
      ]
    },
    "map8_landmark_viaduct": {
      "x": 157,
      "y": 414,
      "w": 8,
      "h": 8,
      "anchor": [
        4,
        7
      ]
    },
    "map8_landmark_windmill": {
      "x": 166,
      "y": 414,
      "w": 8,
      "h": 8,
      "anchor": [
        4,
        7
      ]
    }
  }
}
