{
  "image": "icons.png",
  "size": [
    256,
    38
  ],
  "tile": 16,
  "frames": {
    "carry_bread": {
      "x": 130,
      "y": 17,
      "w": 8,
      "h": 8,
      "anchor": [
        4,
        7
      ]
    },
    "carry_cloth": {
      "x": 139,
      "y": 17,
      "w": 8,
      "h": 8,
      "anchor": [
        4,
        7
      ]
    },
    "carry_fish": {
      "x": 148,
      "y": 17,
      "w": 8,
      "h": 8,
      "anchor": [
        4,
        7
      ]
    },
    "carry_fuel": {
      "x": 157,
      "y": 17,
      "w": 8,
      "h": 8,
      "anchor": [
        4,
        7
      ]
    },
    "carry_milk": {
      "x": 166,
      "y": 17,
      "w": 8,
      "h": 8,
      "anchor": [
        4,
        7
      ]
    },
    "carry_tools": {
      "x": 175,
      "y": 17,
      "w": 8,
      "h": 8,
      "anchor": [
        4,
        7
      ]
    },
    "carry_vegetables": {
      "x": 184,
      "y": 17,
      "w": 8,
      "h": 8,
      "anchor": [
        4,
        7
      ]
    },
    "coin_16": {
      "x": 0,
      "y": 0,
      "w": 16,
      "h": 16,
      "anchor": [
        8,
        15
      ]
    },
    "coin_8": {
      "x": 193,
      "y": 17,
      "w": 8,
      "h": 8,
      "anchor": [
        4,
        7
      ]
    },
    "emote_ball": {
      "x": 0,
      "y": 17,
      "w": 12,
      "h": 12,
      "anchor": [
        6,
        11
      ]
    },
    "emote_coin": {
      "x": 13,
      "y": 17,
      "w": 12,
      "h": 12,
      "anchor": [
        6,
        11
      ]
    },
    "emote_exclaim": {
      "x": 26,
      "y": 17,
      "w": 12,
      "h": 12,
      "anchor": [
        6,
        11
      ]
    },
    "emote_food": {
      "x": 39,
      "y": 17,
      "w": 12,
      "h": 12,
      "anchor": [
        6,
        11
      ]
    },
    "emote_heart": {
      "x": 52,
      "y": 17,
      "w": 12,
      "h": 12,
      "anchor": [
        6,
        11
      ]
    },
    "emote_music": {
      "x": 65,
      "y": 17,
      "w": 12,
      "h": 12,
      "anchor": [
        6,
        11
      ]
    },
    "emote_question": {
      "x": 78,
      "y": 17,
      "w": 12,
      "h": 12,
      "anchor": [
        6,
        11
      ]
    },
    "emote_sleep": {
      "x": 91,
      "y": 17,
      "w": 12,
      "h": 12,
      "anchor": [
        6,
        11
      ]
    },
    "emote_speech": {
      "x": 104,
      "y": 17,
      "w": 12,
      "h": 12,
      "anchor": [
        6,
        11
      ]
    },
    "emote_sweat": {
      "x": 117,
      "y": 17,
      "w": 12,
      "h": 12,
      "anchor": [
        6,
        11
      ]
    },
    "food_bread_16": {
      "x": 17,
      "y": 0,
      "w": 16,
      "h": 16,
      "anchor": [
        8,
        15
      ]
    },
    "food_bread_8": {
      "x": 202,
      "y": 17,
      "w": 8,
      "h": 8,
      "anchor": [
        4,
        7
      ]
    },
    "food_dairy_16": {
      "x": 34,
      "y": 0,
      "w": 16,
      "h": 16,
      "anchor": [
        8,
        15
      ]
    },
    "food_dairy_8": {
      "x": 211,
      "y": 17,
      "w": 8,
      "h": 8,
      "anchor": [
        4,
        7
      ]
    },
    "food_fresh-protein_16": {
      "x": 51,
      "y": 0,
      "w": 16,
      "h": 16,
      "anchor": [
        8,
        15
      ]
    },
    "food_fresh-protein_8": {
      "x": 220,
      "y": 17,
      "w": 8,
      "h": 8,
      "anchor": [
        4,
        7
      ]
    },
    "food_grain_16": {
      "x": 68,
      "y": 0,
      "w": 16,
      "h": 16,
      "anchor": [
        8,
        15
      ]
    },
    "food_grain_8": {
      "x": 229,
      "y": 17,
      "w": 8,
      "h": 8,
      "anchor": [
        4,
        7
      ]
    },
    "food_preserved_16": {
      "x": 85,
      "y": 0,
      "w": 16,
      "h": 16,
      "anchor": [
        8,
        15
      ]
    },
    "food_preserved_8": {
      "x": 238,
      "y": 17,
      "w": 8,
      "h": 8,
      "anchor": [
        4,
        7
      ]
    },
    "food_produce_16": {
      "x": 102,
      "y": 0,
      "w": 16,
      "h": 16,
      "anchor": [
        8,
        15
      ]
    },
    "food_produce_8": {
      "x": 247,
      "y": 17,
      "w": 8,
      "h": 8,
      "anchor": [
        4,
        7
      ]
    },
    "freshness_fresh_8": {
      "x": 0,
      "y": 30,
      "w": 8,
      "h": 8,
      "anchor": [
        4,
        7
      ]
    },
    "freshness_last-day_8": {
      "x": 9,
      "y": 30,
      "w": 8,
      "h": 8,
      "anchor": [
        4,
        7
      ]
    },
    "freshness_stale_8": {
      "x": 18,
      "y": 30,
      "w": 8,
      "h": 8,
      "anchor": [
        4,
        7
      ]
    },
    "good_fresh-food_16": {
      "x": 119,
      "y": 0,
      "w": 16,
      "h": 16,
      "anchor": [
        8,
        15
      ]
    },
    "good_fresh-food_8": {
      "x": 27,
      "y": 30,
      "w": 8,
      "h": 8,
      "anchor": [
        4,
        7
      ]
    },
    "good_fuel_16": {
      "x": 136,
      "y": 0,
      "w": 16,
      "h": 16,
      "anchor": [
        8,
        15
      ]
    },
    "good_fuel_8": {
      "x": 36,
      "y": 30,
      "w": 8,
      "h": 8,
      "anchor": [
        4,
        7
      ]
    },
    "good_grain_16": {
      "x": 153,
      "y": 0,
      "w": 16,
      "h": 16,
      "anchor": [
        8,
        15
      ]
    },
    "good_grain_8": {
      "x": 45,
      "y": 30,
      "w": 8,
      "h": 8,
      "anchor": [
        4,
        7
      ]
    },
    "good_metal_16": {
      "x": 170,
      "y": 0,
      "w": 16,
      "h": 16,
      "anchor": [
        8,
        15
      ]
    },
    "good_metal_8": {
      "x": 54,
      "y": 30,
      "w": 8,
      "h": 8,
      "anchor": [
        4,
        7
      ]
    },
    "good_services_16": {
      "x": 187,
      "y": 0,
      "w": 16,
      "h": 16,
      "anchor": [
        8,
        15
      ]
    },
    "good_services_8": {
      "x": 63,
      "y": 30,
      "w": 8,
      "h": 8,
      "anchor": [
        4,
        7
      ]
    },
    "good_stone_16": {
      "x": 204,
      "y": 0,
      "w": 16,
      "h": 16,
      "anchor": [
        8,
        15
      ]
    },
    "good_stone_8": {
      "x": 72,
      "y": 30,
      "w": 8,
      "h": 8,
      "anchor": [
        4,
        7
      ]
    },
    "good_timber_16": {
      "x": 221,
      "y": 0,
      "w": 16,
      "h": 16,
      "anchor": [
        8,
        15
      ]
    },
    "good_timber_8": {
      "x": 81,
      "y": 30,
      "w": 8,
      "h": 8,
      "anchor": [
        4,
        7
      ]
    },
    "good_wares_16": {
      "x": 238,
      "y": 0,
      "w": 16,
      "h": 16,
      "anchor": [
        8,
        15
      ]
    },
    "good_wares_8": {
      "x": 90,
      "y": 30,
      "w": 8,
      "h": 8,
      "anchor": [
        4,
        7
      ]
    },
    "pip_crime-alert": {
      "x": 99,
      "y": 30,
      "w": 8,
      "h": 8,
      "anchor": [
        4,
        7
      ]
    },
    "pip_house": {
      "x": 108,
      "y": 30,
      "w": 8,
      "h": 8,
      "anchor": [
        4,
        7
      ]
    },
    "pip_records": {
      "x": 117,
      "y": 30,
      "w": 8,
      "h": 8,
      "anchor": [
        4,
        7
      ]
    },
    "pip_stock_0": {
      "x": 126,
      "y": 30,
      "w": 8,
      "h": 8,
      "anchor": [
        4,
        7
      ]
    },
    "pip_stock_1": {
      "x": 135,
      "y": 30,
      "w": 8,
      "h": 8,
      "anchor": [
        4,
        7
      ]
    },
    "pip_stock_2": {
      "x": 144,
      "y": 30,
      "w": 8,
      "h": 8,
      "anchor": [
        4,
        7
      ]
    },
    "pip_stock_3": {
      "x": 153,
      "y": 30,
      "w": 8,
      "h": 8,
      "anchor": [
        4,
        7
      ]
    },
    "pip_struggling": {
      "x": 162,
      "y": 30,
      "w": 8,
      "h": 8,
      "anchor": [
        4,
        7
      ]
    },
    "pip_suffering": {
      "x": 171,
      "y": 30,
      "w": 8,
      "h": 8,
      "anchor": [
        4,
        7
      ]
    },
    "pip_thriving": {
      "x": 180,
      "y": 30,
      "w": 8,
      "h": 8,
      "anchor": [
        4,
        7
      ]
    }
  }
}
