{
  "image": "walls.png",
  "size": [
    256,
    122
  ],
  "tile": 16,
  "frames": {
    "palisade_corner_both": {
      "x": 117,
      "y": 65,
      "w": 16,
      "h": 30,
      "anchor": [
        8,
        29
      ],
      "snow": "palisade_corner_both_snow",
      "footprint": [
        1,
        1
      ],
      "joins": "lr"
    },
    "palisade_corner_both_snow": {
      "x": 134,
      "y": 65,
      "w": 16,
      "h": 30,
      "anchor": [
        8,
        29
      ],
      "layer": "snow",
      "footprint": [
        1,
        1
      ]
    },
    "palisade_corner_left": {
      "x": 151,
      "y": 65,
      "w": 16,
      "h": 30,
      "anchor": [
        8,
        29
      ],
      "snow": "palisade_corner_left_snow",
      "footprint": [
        1,
        1
      ],
      "joins": "ur"
    },
    "palisade_corner_left_snow": {
      "x": 168,
      "y": 65,
      "w": 16,
      "h": 30,
      "anchor": [
        8,
        29
      ],
      "layer": "snow",
      "footprint": [
        1,
        1
      ]
    },
    "palisade_corner_right": {
      "x": 185,
      "y": 65,
      "w": 16,
      "h": 30,
      "anchor": [
        8,
        29
      ],
      "snow": "palisade_corner_right_snow",
      "footprint": [
        1,
        1
      ],
      "joins": "ul"
    },
    "palisade_corner_right_snow": {
      "x": 202,
      "y": 65,
      "w": 16,
      "h": 30,
      "anchor": [
        8,
        29
      ],
      "layer": "snow",
      "footprint": [
        1,
        1
      ]
    },
    "palisade_diagonal-down": {
      "x": 200,
      "y": 0,
      "w": 16,
      "h": 41,
      "anchor": [
        8,
        39
      ],
      "footprint": [
        1,
        1
      ]
    },
    "palisade_diagonal-up": {
      "x": 217,
      "y": 0,
      "w": 16,
      "h": 41,
      "anchor": [
        8,
        39
      ],
      "footprint": [
        1,
        1
      ]
    },
    "palisade_gate_front": {
      "x": 17,
      "y": 65,
      "w": 32,
      "h": 38,
      "anchor": [
        16,
        37
      ],
      "snow": "palisade_gate_front_snow",
      "footprint": [
        2,
        1
      ],
      "joins": "lr"
    },
    "palisade_gate_front_snow": {
      "x": 50,
      "y": 65,
      "w": 32,
      "h": 38,
      "anchor": [
        16,
        37
      ],
      "layer": "snow",
      "footprint": [
        2,
        1
      ]
    },
    "palisade_gate_side-north": {
      "x": 83,
      "y": 65,
      "w": 16,
      "h": 38,
      "anchor": [
        8,
        37
      ],
      "snow": "palisade_gate_side-north_snow",
      "footprint": [
        1,
        1
      ],
      "joins": "u"
    },
    "palisade_gate_side-north_snow": {
      "x": 100,
      "y": 65,
      "w": 16,
      "h": 38,
      "anchor": [
        8,
        37
      ],
      "layer": "snow",
      "footprint": [
        1,
        1
      ]
    },
    "palisade_gate_side-south": {
      "x": 0,
      "y": 106,
      "w": 16,
      "h": 16,
      "anchor": [
        8,
        15
      ],
      "snow": "palisade_gate_side-south_snow",
      "footprint": [
        1,
        1
      ],
      "joins": ""
    },
    "palisade_gate_side-south_snow": {
      "x": 17,
      "y": 106,
      "w": 16,
      "h": 16,
      "anchor": [
        8,
        15
      ],
      "layer": "snow",
      "footprint": [
        1,
        1
      ]
    },
    "palisade_horizontal": {
      "x": 219,
      "y": 65,
      "w": 16,
      "h": 26,
      "anchor": [
        8,
        25
      ],
      "snow": "palisade_horizontal_snow",
      "footprint": [
        1,
        1
      ],
      "joins": "lr"
    },
    "palisade_horizontal_snow": {
      "x": 236,
      "y": 65,
      "w": 16,
      "h": 26,
      "anchor": [
        8,
        25
      ],
      "layer": "snow",
      "footprint": [
        1,
        1
      ]
    },
    "palisade_vertical": {
      "x": 34,
      "y": 106,
      "w": 16,
      "h": 16,
      "anchor": [
        8,
        15
      ],
      "snow": "palisade_vertical_snow",
      "footprint": [
        1,
        1
      ],
      "joins": "u"
    },
    "palisade_vertical_snow": {
      "x": 51,
      "y": 106,
      "w": 16,
      "h": 16,
      "anchor": [
        8,
        15
      ],
      "layer": "snow",
      "footprint": [
        1,
        1
      ]
    },
    "wall_diagonal-down": {
      "x": 66,
      "y": 0,
      "w": 16,
      "h": 55,
      "anchor": [
        8,
        47
      ],
      "footprint": [
        1,
        1
      ]
    },
    "wall_diagonal-up": {
      "x": 83,
      "y": 0,
      "w": 16,
      "h": 55,
      "anchor": [
        8,
        47
      ],
      "footprint": [
        1,
        1
      ]
    },
    "wall_gate_front": {
      "x": 100,
      "y": 0,
      "w": 32,
      "h": 48,
      "anchor": [
        16,
        47
      ],
      "snow": "wall_gate_front_snow",
      "footprint": [
        2,
        1
      ],
      "joins": "lr"
    },
    "wall_gate_front_snow": {
      "x": 133,
      "y": 0,
      "w": 32,
      "h": 48,
      "anchor": [
        16,
        47
      ],
      "layer": "snow",
      "footprint": [
        2,
        1
      ]
    },
    "wall_gate_side-north": {
      "x": 166,
      "y": 0,
      "w": 16,
      "h": 48,
      "anchor": [
        8,
        47
      ],
      "snow": "wall_gate_side-north_snow",
      "footprint": [
        1,
        1
      ],
      "joins": "u"
    },
    "wall_gate_side-north_snow": {
      "x": 183,
      "y": 0,
      "w": 16,
      "h": 48,
      "anchor": [
        8,
        47
      ],
      "layer": "snow",
      "footprint": [
        1,
        1
      ]
    },
    "wall_gate_side-south": {
      "x": 68,
      "y": 106,
      "w": 16,
      "h": 16,
      "anchor": [
        8,
        15
      ],
      "snow": "wall_gate_side-south_snow",
      "footprint": [
        1,
        1
      ],
      "joins": ""
    },
    "wall_gate_side-south_snow": {
      "x": 85,
      "y": 106,
      "w": 16,
      "h": 16,
      "anchor": [
        8,
        15
      ],
      "layer": "snow",
      "footprint": [
        1,
        1
      ]
    },
    "wall_horizontal": {
      "x": 234,
      "y": 0,
      "w": 16,
      "h": 40,
      "anchor": [
        8,
        39
      ],
      "snow": "wall_horizontal_snow",
      "footprint": [
        1,
        1
      ],
      "joins": "lr"
    },
    "wall_horizontal_snow": {
      "x": 0,
      "y": 65,
      "w": 16,
      "h": 40,
      "anchor": [
        8,
        39
      ],
      "layer": "snow",
      "footprint": [
        1,
        1
      ]
    },
    "wall_tower": {
      "x": 0,
      "y": 0,
      "w": 32,
      "h": 64,
      "anchor": [
        16,
        63
      ],
      "snow": "wall_tower_snow",
      "footprint": [
        2,
        2
      ]
    },
    "wall_tower_snow": {
      "x": 33,
      "y": 0,
      "w": 32,
      "h": 64,
      "anchor": [
        16,
        63
      ],
      "layer": "snow",
      "footprint": [
        2,
        2
      ]
    },
    "wall_vertical": {
      "x": 102,
      "y": 106,
      "w": 16,
      "h": 16,
      "anchor": [
        8,
        15
      ],
      "snow": "wall_vertical_snow",
      "footprint": [
        1,
        1
      ],
      "joins": "u"
    },
    "wall_vertical_snow": {
      "x": 119,
      "y": 106,
      "w": 16,
      "h": 16,
      "anchor": [
        8,
        15
      ],
      "layer": "snow",
      "footprint": [
        1,
        1
      ]
    }
  }
}
